{
  "$schema": "schemas/index.schema.json",
  "version": 1,
  "generatedAt": "2026-10-17T17:20:13.1314266+00:00",
  "plugins": [
    "app.counttogether.counttogether-macro-deck-plugin",
    "com.cjhackeryt.hwinfodeck",
    "com.cjhackeryt.screenxdeck",
    "com.cjhackeryt.soundbox",
    "com.cjhackeryt.spicetifydeck",
    "com.cjhackeryt.steelseriessonar",
    "com.diegofdezab.volume-mixer",
    "com.dodecadev.gpu-z",
    "com.dodecadev.philips-hue",
    "com.dodecadev.vscode",
    "com.hashashin.fxcommands",
    "com.hashashin.octoprint",
    "com.inariix.mbxhub-plugin",
    "com.jhnnr.calendar",
    "com.kickfireice.vesktop-bridge",
    "com.kickfireice.wavelink-bridge",
    "com.multidisplayvcp.client",
    "com.pyflat.device-battery-info",
    "com.pyflat.printer-control",
    "com.pyflat.system-hotkeys",
    "com.pyflat.system-media",
    "com.sarti2004.dorideck",
    "com.squibsland.beefweb",
    "com.suchbyte.ghub-batteries",
    "com.suchbyte.todo-list-plugin",
    "com.tabsik12.ets2-telemetry",
    "com.tabsik12.minecraft-macrolink",
    "com.tabsik12.tuya-control",
    "com.yussefabdelwahab.comfyui-job-monitor",
    "com.yussefabdelwahab.image-slideshow",
    "com.yussefabdelwahab.nvidia-smi-tool",
    "net.ziopuzzle.custombutton"
  ],
  "iconPacks": [
    "com.dodecadev.powered-steel",
    "com.fire.black-gold-luxury",
    "com.simplyjames.mdi-icons",
    "com.suchbyte.colorful-generic-icons",
    "exe.radioactive.simple-hand-drawn-icons-black",
    "exe.radioactive.simple-hand-drawn-icons-white"
  ],
  "templates": {
    "automations": [],
    "folders": [],
    "profiles": [],
    "widgets": []
  }
}
